{
  "scale": "XS",
  "protocol": "xs-lite",
  "execution_mode": "serial",
  "fallback_reason": "XS protocol permits inline execution when no delegation is needed.",
  "document_set_plan_required": false,
  "delegated_stages": [],
  "safety_risks": [],
  "notes": [
    "Validate path safety and changed link."
  ]
}
